orgao,unidade,data,empenho,processo,credor,cpf_cnpj,pago,retido,anulacao,acao,funcao,subfuncao,programa,categoria_economica,natureza_despesa,modalidade_aplicacao,elemento,subelemento,fonte_de_recurso,conta_banco,tipo,no_doc,data_atesto,responsavel_atesto,historico_empenho,historico_pagamento
26000 - PREFEITURA MUNICIPAL DE BARRA DOS COQUEIROS,26049 - SECRETARIA MUN DE OBRAS PÚBLICAS,19/11/2020,0901002,1119002,JP'FORT ENGENHARIA E CONSULTORIA LTDA,13.014.144/0001-49,"R$ 111.032,95","R$ 14.545,31","R$ 0,00","1034 - CONSTRUÇÃO, RESTAURAÇÃO, DRENAGEM, PAVIMENTAÇÃO E URBANIZAÇÃO DE ÁREAS",15 - Urbanismo,451 - Infraestrutura Urbana,0126 - CONSTRUINDO CIDADANIA,40000000 - DESPESAS DE CAPITAL,44000000 - INVESTIMENTOS,44900000 - APLICAÇÕES DIRETAS,44905100 - Obras e Instalações,44905103 - Obras E/ou Edificações Para Uso Comum do Povo,15300000 - Transferência da União Referente a Royalties do Petróleo,Bc: 001 / Ag: 3611 / CC: 804770,Autorização de Débito,1548,,,"REMANEJAMENTO DE FONTE DE RECURSOS PRA A EXECUÇÃO DE TERRAPLENAGEM, DRENAGEM PLUVIAL E PAVIMENTAÇÃO A PARALELEPÍPEDO DA RUA NOVA E ADJACÊNCIAS NO POVOADO CAPUÃ","EXECUÇÃO DE TERRAPLENAGEM, DRENAGEM PLUVIAL E PAVIMENTAÇÃO A PARALELEPÍPEDO DA RUA NOVA E ADJACÊNCIAS NO POVOADO CAPUÃ REFERENTE A 5ª MEDIÇÃO CONF NF 0069"
26000 - PREFEITURA MUNICIPAL DE BARRA DOS COQUEIROS,26049 - SECRETARIA MUN DE OBRAS PÚBLICAS,18/11/2020,1106003,1118007,FSS CONSTRUÇÃO E ENERGIA EIRELI - ME,13.525.006/0001-24,"R$ 157.636,20","R$ 13.871,98","R$ 0,00","1034 - CONSTRUÇÃO, RESTAURAÇÃO, DRENAGEM, PAVIMENTAÇÃO E URBANIZAÇÃO DE ÁREAS",15 - Urbanismo,451 - Infraestrutura Urbana,0126 - CONSTRUINDO CIDADANIA,40000000 - DESPESAS DE CAPITAL,44000000 - INVESTIMENTOS,44900000 - APLICAÇÕES DIRETAS,44905100 - Obras e Instalações,44905103 - Obras E/ou Edificações Para Uso Comum do Povo,15300000 - Transferência da União Referente a Royalties do Petróleo,Bc: 001 / Ag: 3611 / CC: 804770,Autorização de Débito,1535,,,"CORRESPONDENTE AO 1º TERMO ADITOVO PARA OS SERVIÇO REMANESCENTE DE MANUTENÇÃO E AMPLIAÇÃO DA PROTEÇÃO MARGINAL ( MOLHE ) DA ATALAIA NOVA, NO MUNICIPIO DE BARRA DOS COQUEIROS-SE","REFERENTE A 7º BOLETIM DE MEDIÇÃO DO MOLHE CONF NF 0169 CORRESPONDENTE AO 1º TERMO ADITOVO PARA OS SERVIÇO REMANESCENTE DE MANUTENÇÃO E AMPLIAÇÃO DA PROTEÇÃO MARGINAL ( MOLHE ) DA ATALAIA NOVA, NO MUNICIPIO DE BARRA DOS COQUEIROS-SE"
26000 - PREFEITURA MUNICIPAL DE BARRA DOS COQUEIROS,26049 - SECRETARIA MUN DE OBRAS PÚBLICAS,09/11/2020,0813004,1109001,RECONSTRUIR CONSTRUCOES E REFORMA EIRELI,30.552.909/0001-13,"R$ 16.622,94","R$ 334,12","R$ 0,00","1032 - CONSTRUÇÃO, REFORMA E RESTAURAÇÃO DE PRAÇAS, PARQUES E JARDINS",15 - Urbanismo,451 - Infraestrutura Urbana,0126 - CONSTRUINDO CIDADANIA,40000000 - DESPESAS DE CAPITAL,44000000 - INVESTIMENTOS,44900000 - APLICAÇÕES DIRETAS,44905100 - Obras e Instalações,44905103 - Obras E/ou Edificações Para Uso Comum do Povo,15300000 - Transferência da União Referente a Royalties do Petróleo,Bc: 001 / Ag: 3611 / CC: 804770,Autorização de Débito,1472,,,CORRESPONDENTE A PISO DE ALTA RESISTENCIA INDUSTRIAL DE 12MM COMUM COR CINZA -- QUADRA POLIESPORTIVA DO POVOADO CANAL DE SÃO SEBASTIÃO,CORRESPONDENTE A PISO DE ALTA RESISTENCIA INDUSTRIAL DE 12MM COMUM COR CINZA -- QUADRA POLIESPORTIVA DO POVOADO CANAL DE SÃO SEBASTIÃO
26000 - PREFEITURA MUNICIPAL DE BARRA DOS COQUEIROS,26049 - SECRETARIA MUN DE OBRAS PÚBLICAS,06/11/2020,1005013,1106059,JS CARVALHO SERVICOS E LOCACAO EIRELI,18.674.609/0001-01,"R$ 85.347,52","R$ 6.401,06","R$ 0,00","1032 - CONSTRUÇÃO, REFORMA E RESTAURAÇÃO DE PRAÇAS, PARQUES E JARDINS",15 - Urbanismo,451 - Infraestrutura Urbana,0126 - CONSTRUINDO CIDADANIA,40000000 - DESPESAS DE CAPITAL,44000000 - INVESTIMENTOS,44900000 - APLICAÇÕES DIRETAS,44905100 - Obras e Instalações,44905103 - Obras E/ou Edificações Para Uso Comum do Povo,15300000 - Transferência da União Referente a Royalties do Petróleo,Bc: 001 / Ag: 3611 / CC: 804770,Autorização de Débito,1473,,,"REFORMA E AMPLIAÇÃO DAS PRAÇAS DO ROMILDO, DO MARIVAN, DA QUADRA DO ANDORINHA ;CAPACIDADE TÉCNICA E FINANCEIRA PARA EXECUTAR AS REFORMAS E AMPLIAÇÕES DAS PRAÇAS Nº 01, 02 E 03 DO LOTEAMENTO RIO MAR, NO MUNICIPIO DE BARRA DOS COQUEIROS -SE - ALTERAÇÃO DE FONTE DE RECURSO DO EMPENHO ANTERIOR 0507003","REFERENTE AOS SERVIÇOS CONF NF 0118 - 4ª MEDIÇÃO REFORMA E AMPLIAÇÃO DAS PRAÇAS DO ROMILDO, DO MARIVAN, DA QUADRA DO ANDORINHA ;CAPACIDADE TÉCNICA E FINANCEIRA PARA EXECUTAR AS REFORMAS E AMPLIAÇÕES DAS PRAÇAS Nº 01, 02 E 03 DO LOTEAMENTO RIO MAR, NO MUNICIPIO DE BARRA DOS COQUEIROS -SE - ALTERAÇÃO DE FONTE DE RECURSO DO EMPENHO ANTERIOR 0507003"
26000 - PREFEITURA MUNICIPAL DE BARRA DOS COQUEIROS,26049 - SECRETARIA MUN DE OBRAS PÚBLICAS,06/11/2020,0813005,1106030,ALMEIDA CAMPOS CONSTRUCOES E SERVICOS LTDA,26.956.726/0001-96,"R$ 81.759,81","R$ 7.129,46","R$ 0,00","1034 - CONSTRUÇÃO, RESTAURAÇÃO, DRENAGEM, PAVIMENTAÇÃO E URBANIZAÇÃO DE ÁREAS",15 - Urbanismo,451 - Infraestrutura Urbana,0126 - CONSTRUINDO CIDADANIA,40000000 - DESPESAS DE CAPITAL,44000000 - INVESTIMENTOS,44900000 - APLICAÇÕES DIRETAS,44905100 - Obras e Instalações,44905103 - Obras E/ou Edificações Para Uso Comum do Povo,15300000 - Transferência da União Referente a Royalties do Petróleo,Bc: 001 / Ag: 3611 / CC: 804770,Autorização de Débito,1466,,,CORRESPONDENTE A CONSTRUÇÃO DE RETORNO NA RODOVIA SE - 449 - TRECHO PONTE CONSTRUTOR JOÃO ALVES / ENTRADA DA SE 100 - BARRA DOS COQUEIROS - SE,CORRESPONDENTE A CONSTRUÇÃO DE RETORNO NA RODOVIA SE - 449 - TRECHO PONTE CONSTRUTOR JOÃO ALVES / ENTRADA DA SE 100 - BARRA DOS COQUEIROS - SE REFERENTE A 2ª MEDIÇÃO CONF NF 0020
26000 - PREFEITURA MUNICIPAL DE BARRA DOS COQUEIROS,26049 - SECRETARIA MUN DE OBRAS PÚBLICAS,05/11/2020,1105001,1105019,VIA NORTE CONSTRUÇÕES E SERVIÇOS DE LOCAÇÃO DE MÃO DE OBRA EIRELI,07.383.716/0001-64,"R$ 730.253,89","R$ 0,00","R$ 0,00",2059 - MANUTENÇÃO DE LIMPEZA PÚBLICA,15 - Urbanismo,451 - Infraestrutura Urbana,0126 - CONSTRUINDO CIDADANIA,30000000 - DESPESAS CORRENTES,33000000 - OUTRAS DESPESAS CORRENTES,33900000 - APLICAÇÕES DIRETAS,33903900 - Outros Serviços de Terceiros - Pessoa Jurídica,33903961 - Limpeza e Conservação,15300000 - Transferência da União Referente a Royalties do Petróleo,Bc: 001 / Ag: 3611 / CC: 804770,Autorização de Débito,1441,,,"CORRESPONDENTE AOS SERVIÇOS DE COLETA DE LIXO URBANO E SERVIÇOS DE LIMPEZA URBANO, PARA ATENDER AS NECESSIDADES DO MUNICÍPIO NO CORRENTE EXERCICIO - ALTERAÇÃO DE FONTE DE RECURSO",REF A COLETA SELETIVA DE LIXO CONF NF 0359 - MES 10/2020 - COMPLEMENTO
26000 - PREFEITURA MUNICIPAL DE BARRA DOS COQUEIROS,26049 - SECRETARIA MUN DE OBRAS PÚBLICAS,05/11/2020,1005001,1105020,VIA NORTE CONSTRUÇÕES E SERVIÇOS DE LOCAÇÃO DE MÃO DE OBRA EIRELI,07.383.716/0001-64,"R$ 220.837,08","R$ 57.064,38","R$ 0,00",2059 - MANUTENÇÃO DE LIMPEZA PÚBLICA,15 - Urbanismo,451 - Infraestrutura Urbana,0126 - CONSTRUINDO CIDADANIA,30000000 - DESPESAS CORRENTES,33000000 - OUTRAS DESPESAS CORRENTES,33900000 - APLICAÇÕES DIRETAS,33903900 - Outros Serviços de Terceiros - Pessoa Jurídica,33903961 - Limpeza e Conservação,15300000 - Transferência da União Referente a Royalties do Petróleo,Bc: 001 / Ag: 3611 / CC: 804770,Autorização de Débito,1441,,,"CORRESPONDENTE AOS SERVIÇOS DE COLETA DE LIXO URBANO E SERVIÇOS DE LIMPEZA URBANO, PARA ATENDER AS NECESSIDADES DO MUNICÍPIO NO CORRENTE EXERCICIO - ALTERAÇÃO DE FONTE DE RECURSO",REF A COLETA SELETIVA DE LIXO CONF NF 0359 - MES 10/2020 - PARTE
