orgao,unidade,data,empenho,processo,credor,cpf_cnpj,pago,retido,anulacao,acao,funcao,subfuncao,programa,categoria_economica,natureza_despesa,modalidade_aplicacao,elemento,subelemento,fonte_de_recurso,conta_banco,tipo,no_doc,data_atesto,responsavel_atesto,historico_empenho,historico_pagamento
03 - SECRETARIA MUNICIPAL DE PLANEJAMENTO E FINANÇAS,0301 - SECRETARIA MUNICIPAL DE PLANEJAMENTO E FINANÇAS,30/05/2018,333,3286,FLAVIO ALMEIDA ADVOGADOS ASSOCIADOS,07.529.109/0001-60,"R$ 123.405,62","R$ 0,00","R$ 0,00",2002 - MANUTENÇÃO DA SECRETARIA DE PLANEJAMENTO E FINANÇAS,04 - Administração,122 - Administração Geral,0001 - DESENVOLVIMENTO DA GESTÃO ADMINISTRATIVA,30000000 - DESPESAS CORRENTES,33000000 - OUTRAS DESPESAS CORRENTES,33900000 - APLICAÇÕES DIRETAS,33903900 - Outros Serviços de Terceiros - Pessoa Jurídica,33903999 - Outros Serviços de Terceiros - Pessoa Jurídica,0199100 - Royalties - Royalties/Fundo Especial do Petróleo/ Compensação Financeira exploração de recursos minerais,Bc: 001 / Ag: 22063 / CC: 1360728,Autorização de Débito,053002,,,"CORRESPONDENTE A PRESTAÇÃO DE SERVIÇOS DE ASSESSORIA JURÍDICA NA ÁREA TRIBUTÁRIA, ADOTANDO MEDIDAS ADMINISTRATIVAS E/OU JUDICIAIS NO SENTIDO DA EXECUÇÃO DE SERVIÇOS A FIM DE INCLUIR, ENQUADRAR OU REINCLUIR O CONTRATANTE NO ROL DE BENEFICIÁRIOS DE PARTICIPAÇÕES GOVERNAMENTAIS ORIUNDAS DA INDUSTRIA DE PETROLEO E GÁS NATURAL (ROYALTIES DO PETROLEO E PARTICIPAÇÃO ESPECIAL), E PELA INSTALAÇÃO DE EMBARQUE E DESEMBARQUE - ESTAÇÃO COLETORA TARTARUGA, DE RESPONSABILIDADE DA ANP(AGÊNCIA NACIONAÇ DO PETRÓLEO), CONFORME CONTRATO DE Nº 33/2015 E INEXIGIBILIDADE DE LICITAÇÃO Nº 06/2015.","NF 3955/2018 - PRESTAÇÃO DE SERVIÇOS DE ASSESSORIA JURÍDICA NA ÁREA TRIBUTÁRIA, COMP. 05/2018."
03 - SECRETARIA MUNICIPAL DE PLANEJAMENTO E FINANÇAS,0301 - SECRETARIA MUNICIPAL DE PLANEJAMENTO E FINANÇAS,24/05/2018,380,3060,MINISTERIO DA FAZENDA,00.394.460/0092-89,"R$ 60,25","R$ 0,00","R$ 0,00",2004 - CONTRIBUIÇÃO PARA O PASEP,04 - Administração,122 - Administração Geral,0001 - DESENVOLVIMENTO DA GESTÃO ADMINISTRATIVA,30000000 - DESPESAS CORRENTES,33000000 - OUTRAS DESPESAS CORRENTES,33900000 - APLICAÇÕES DIRETAS,33904700 - Obrigações Tributárias e Contributivas,33904712 - Contribuicao Para O Pis ou Pasep,0199100 - Royalties - Royalties/Fundo Especial do Petróleo/ Compensação Financeira exploração de recursos minerais,Bc: 047 / Ag: 59 / CC: 3000051,Autorização de Débito,9999,,,CORRESPONDENTE A DESPESA COM PASEP DURANTE O EXERCÍCIO DE 2018.,DESPESA COM PASEP - ROYALTIES ESTADUAL
03 - SECRETARIA MUNICIPAL DE PLANEJAMENTO E FINANÇAS,0301 - SECRETARIA MUNICIPAL DE PLANEJAMENTO E FINANÇAS,23/05/2018,380,2786,MINISTERIO DA FAZENDA,00.394.460/0092-89,"R$ 8.397,36","R$ 0,00","R$ 0,00",2004 - CONTRIBUIÇÃO PARA O PASEP,04 - Administração,122 - Administração Geral,0001 - DESENVOLVIMENTO DA GESTÃO ADMINISTRATIVA,30000000 - DESPESAS CORRENTES,33000000 - OUTRAS DESPESAS CORRENTES,33900000 - APLICAÇÕES DIRETAS,33904700 - Obrigações Tributárias e Contributivas,33904712 - Contribuicao Para O Pis ou Pasep,0199100 - Royalties - Royalties/Fundo Especial do Petróleo/ Compensação Financeira exploração de recursos minerais,Bc: 001 / Ag: 22063 / CC: 1360728,Autorização de Débito,05,,,CORRESPONDENTE A DESPESA COM PASEP DURANTE O EXERCÍCIO DE 2018.,"DESPESA COM PASEP - FEP , ANP ROYALTIES."
17 - SECRETARIA MUNICIPAL DE TRANSPORTE E TRÂNSITO,1701 - SECRETARIA MUNICIPAL DE TRANSPORTE E TRÂNSITO,10/05/2018,996,2673,Via locações e eventos ltda,10.526.532/0001-10,"R$ 10.108,80","R$ 0,00","R$ 0,00",2045 - MANUTENÇÃO DA SECRETARIA MUNICIPAL DE TRANSPORTE E TRÂNSITO,15 - Urbanismo,782 - Transporte Rodoviário,0003 - PROMOVENDO O DESENVOLVIMENTO URBANO E RURAL,30000000 - DESPESAS CORRENTES,33000000 - OUTRAS DESPESAS CORRENTES,33900000 - APLICAÇÕES DIRETAS,33903900 - Outros Serviços de Terceiros - Pessoa Jurídica,33903912 - Locacao de Maquinas e Equipamentos,0199100 - Royalties - Royalties/Fundo Especial do Petróleo/ Compensação Financeira exploração de recursos minerais,Bc: 047 / Ag: 59 / CC: 3000019,Autorização de Débito,1016091,,,"CORRESPONDENTE REGISTRO DE PREÇOS PARA EVENTUAL PRESTAÇÃO DE SERVIÇOS NA LOCAÇÃO DE VEÍCULOS TIPO ÔNIBUS PARA VIAGENS MUNICIPAIS E INTERMUNICIPAIS REALIZADAS PELAS SECRETARIAS DESTE MUNICÍPIO DE PIRAMBU - SERGIPE , CONFORME PREGÃO PRESENCIAL SRP Nº 17/2017 E ATA DE REGISTRO DE PREÇOS Nº 21/2017 - ATIVIDADE EXTRA CURRICULARES REALIZADA DURANTE O MES DE ABRIL/2018.",NF 197/2018 - LOCAÇÃO DE VEÍCULOS TIPO ÔNIBUS PARA VIAGENS MUNICIPAIS E INTERMUNICIPAIS REALIZADAS PELAS SECRETARIAS DESTE MUNICÍPIO DE PIRAMBU - SERGIPE.
15 - SECRETARIA MUNICIPAL DE OBRAS,1501 - SECRETARIA MUNICIPAL DE OBRAS,09/05/2018,1013,2668,LOC CONSTRUCOES E EMPREENDIMENTOS LTDA,04.214.147/0001-35,"R$ 106.542,06","R$ 12.252,33","R$ 0,00",2042 - MANUTENÇÃO DE SERVIÇOS PÚBLICOS DIVERSOS,15 - Urbanismo,451 - Infraestrutura Urbana,0003 - PROMOVENDO O DESENVOLVIMENTO URBANO E RURAL,30000000 - DESPESAS CORRENTES,33000000 - OUTRAS DESPESAS CORRENTES,33900000 - APLICAÇÕES DIRETAS,33903900 - Outros Serviços de Terceiros - Pessoa Jurídica,33903961 - Limpeza e Conservação,0199100 - Royalties - Royalties/Fundo Especial do Petróleo/ Compensação Financeira exploração de recursos minerais,Bc: 047 / Ag: 59 / CC: 3000060,Autorização de Débito,1035769,,,"CORRESPONDENTE 8º TERMO ADITIVO DE PRORROGAÇÃO DE PRAZO E VALOR AO CONTRATO N° 165/2012, SERVIÇOS DE GERENCIAMENTO DE RESIDUOS URBANOS NO MUNICIPIO DE PIRAMBU/SE, DECORRENTE DE PROCESSO DE LICITAÇÃO, MODALIDADE PREGÃO PRESENCIAL Nº 11/2012.",NF 199/2018 - SERVIÇOS DE GERENCIAMENTO DE RESIDUOS URBANOS NO MUNICIPIO DE PIRAMBU/SE.
03 - SECRETARIA MUNICIPAL DE PLANEJAMENTO E FINANÇAS,0301 - SECRETARIA MUNICIPAL DE PLANEJAMENTO E FINANÇAS,03/05/2018,333,2608,FLAVIO ALMEIDA ADVOGADOS ASSOCIADOS,07.529.109/0001-60,"R$ 112.908,38","R$ 0,00","R$ 0,00",2002 - MANUTENÇÃO DA SECRETARIA DE PLANEJAMENTO E FINANÇAS,04 - Administração,122 - Administração Geral,0001 - DESENVOLVIMENTO DA GESTÃO ADMINISTRATIVA,30000000 - DESPESAS CORRENTES,33000000 - OUTRAS DESPESAS CORRENTES,33900000 - APLICAÇÕES DIRETAS,33903900 - Outros Serviços de Terceiros - Pessoa Jurídica,33903999 - Outros Serviços de Terceiros - Pessoa Jurídica,0199100 - Royalties - Royalties/Fundo Especial do Petróleo/ Compensação Financeira exploração de recursos minerais,Bc: 001 / Ag: 22063 / CC: 1360728,Autorização de Débito,050301,,,"CORRESPONDENTE A PRESTAÇÃO DE SERVIÇOS DE ASSESSORIA JURÍDICA NA ÁREA TRIBUTÁRIA, ADOTANDO MEDIDAS ADMINISTRATIVAS E/OU JUDICIAIS NO SENTIDO DA EXECUÇÃO DE SERVIÇOS A FIM DE INCLUIR, ENQUADRAR OU REINCLUIR O CONTRATANTE NO ROL DE BENEFICIÁRIOS DE PARTICIPAÇÕES GOVERNAMENTAIS ORIUNDAS DA INDUSTRIA DE PETROLEO E GÁS NATURAL (ROYALTIES DO PETROLEO E PARTICIPAÇÃO ESPECIAL), E PELA INSTALAÇÃO DE EMBARQUE E DESEMBARQUE - ESTAÇÃO COLETORA TARTARUGA, DE RESPONSABILIDADE DA ANP(AGÊNCIA NACIONAÇ DO PETRÓLEO), CONFORME CONTRATO DE Nº 33/2015 E INEXIGIBILIDADE DE LICITAÇÃO Nº 06/2015.","CORRESP. A PRESTAÇÃO DE SERVIÇOS DE ASSESSORIA JURÍDICA NA ÁREA TRIBUTÁRIA, ADOTANDO MEDIDAS ADMINISTRATIVAS E/OU JUDICIAIS NO SENTIDO DA EXECUÇÃO DE SERVIÇOS A FIM DE INCLUIR, ENQUADRAR OU REINCLUIR O CONTRATANTE NO ROL DE BENEFICIÁRIOS DE PARTICIPAÇÕES GOVERNAMENTAIS ORIUNDAS DA INDUSTRIA DE PETROLEO E GÁS NATURAL (ROYALTIES DO PETROLEO E PARTICIPAÇÃO ESPECIAL), E PELA INSTALAÇÃO DE EMBARQUE E DESEMBARQUE - ESTAÇÃO COLETORA TARTARUGA, DE RESPONSABILIDADE DA ANP(AGÊNCIA NACIONAÇ DO PETRÓLEO), COMP. 04/2018 E NFº 3826."
